Symbol,Name
TGAF.TO,Tralucent Global Alt [Long/Short] Equity Fund
TGED.TO,TD Active Global Enhanced Dividend ETF
TGED.U.TO,TD Active Global Enhanced Div ETF USD
TGFI.TO,TD Active Global Income ETF
TGGR.TO,TD Active Global Equity Growth ETF
TGO.TO,Terago Inc
TGRE.TO,TD Active Global Real Estate Equity ETF
TGRO.TO,TD Growth Portfolio ETF
TH.TO,Theratechnologies
The.TO,TD Intl Equity CAD Hedge Index ETF
THNC.TO,Thinkific Labs Inc
THU.TO,TD S&P 500 CAD Hedge Index ETF
TI.TO,Titan Mining Corp
TIH.TO,Toromont Ind
TILV.TO,TD Systematic Intl Equity Low Vol ETF
TINF.TO,TD Active Global Infrastructure Eqty ETF
TIPS.TO,BMO US TIPS Index ETF
TIPS.F.TO,BMO US TIPS Index ETF Hdg
TIXT.TO,Telus International [Cda] Inc
TKN.TO,Ninepoint Web3 Innovators Fund
TKN.U.TO,Ninepoint Web3 Innovators Fund
TKO.TO,Taseko Mines Ltd
TLF.TO,Brompton Tech Leaders Income ETF
TLF.U.TO,Brompton Tech Leaders Income ETF USD
TLG.TO,Troilus Gold Corp
TLO.TO,Talon Metals Corp
TLRY.TO,Tilray Inc
TLV.TO,Invesco SP TSX Low Vol Idx ETF
TMCC.TO,TD Morningstar ESG Can Corp Bnd Indx ETF
TMD.TO,Titan Medical Inc
TMEC.TO,TD Morningstar ESG Cda Eqty Idx ETF
TMEI.TO,TD Morningstar ESG Intl Eqty Idx ETF
TMEU.TO,TD Morningstar ESG US Equity Index ETF
TML.TO,Treasury Metals Inc
TMQ.TO,Trilogy Metals Inc
TMUC.TO,TD Morningstar ESG US Corp Bnd Index ETF
TNT.UN.TO,True North Commercial REIT
TNZ.TO,Tenaz Energy Corp
TOT.TO,Total Energy Services Inc
TOU.TO,Tourmaline Oil Corp
TOWR.TO,BMO Brookfield Gbl Real Est Tech Fnd ETF
TOY.TO,Spin Master Corp
TPAY.TO,TD Income Builder ETF
TPE.TO,TD International Equity Index ETF
TPRF.TO,TD Active Preferred Share ETF
TPU.TO,TD S&P 500 Index ETF
TPU.U.TO,TD U.S. Equity Index Et
TPX.A.TO,Molson Coors Canada Inc Cl A Lv
TPX.B.TO,Molson Coors Canada Inc Cl B NV
TPZ.TO,Topaz Energy Corp
TQCD.TO,TD Q Canadian Dividend ETF
TQGD.TO,TD Q Global Dividend ETF
TQGM.TO,TD Q Global Multifactor ETF
TQSM.TO,TD Q US Small Mid Cap Eqty ETF
TRI.TO,Thomson Reuters Corp
TRI.PR.B.TO,Thomson Reuters Corp Prf Srs 2
TRP.TO,TC Energy Corp
TRP.PR.A.TO,Transcanada Corp Pref Ser 1
TRP.PR.B.TO,Transcanada Corp Pref Ser 3
TRP.PR.C.TO,Transcanada Corp Pref Ser 5
TRP.PR.D.TO,Transcanada Corp Pref Ser 7
TRP.PR.E.TO,Transcanada Corp Pref Ser 9
TRP.PR.F.TO,Transcanada Corp Pref Ser 2
TRP.PR.G.TO,Transcanada Corp Pref Ser 11
TRP.PR.H.TO,Transcanada Corp Pref Ser 4
TRP.PR.I.TO,Transcanada Corp Pref Ser 6
TRVI.TO,Harvest Travel and Leisure Income ETF
TRVL.TO,Harvest Travel and Leisure Index ETF
TRVL.U.TO,Harvest Travel and Leisure ETF USD
TRX.TO,Trx Gold Corporation
TRZ.TO,Transat At Inc
TSAT.TO,Telesat Corp
TSK.TO,Talisker Resources Ltd
TSL.TO,Tree Island Steel Ltd
TSND.TO,Terrascend Corp
TSU.TO,Trisura Group Ltd
TTNM.TO,Titanium Transportation Group Inc
TTP.TO,TD S&P TSX Capped Comp Index ETF
TUED.TO,TD Active US Enhanced Dividend ETF
TUED.U.TO,TD Active US Enhanced Dividend ETF USD
TUEX.TO,TD Active US Enhanced Div CAD Hdg ETF
TUHY.TO,TD Active US High Yield Bond ETF
TULB.TO,TD US Long Term Treasury Bond ETF
TULV.TO,TD Q US Low Volatility ETF
TUSB.TO,TD Select U.S. Short Term Corporate Bond
TUSB.U.TO,TD Select US Short Term Corp Bnd ETF USD
TVA.B.TO,Tva Group Inc Cl B NV
TVE.TO,Tamarack Valley Energy Ltd
TVK.TO,Terravest Capital Inc
TWC.TO,Twc Enterprises Ltd
TWM.TO,Tidewater Midstream and Infras Ltd
TWM.DB.TO,Tidewater Midstream Infras 5.5 Pct Debs
TWM.WT.TO,Tidewater Midstream and Infrastructure WT
TXF.TO,CI Tech Giants Covered Call ETF
TXF.B.TO,CI Tech Giants Cov Call Unheg
TXF.U.TO,CI Tech Giants Covered Call ETF USD
TXG.TO,Torex Gold Resources Inc
TXP.TO,Touchstone Exploration Inc
TXT.PR.A.TO,Top 10 Split Trust Pref A
TXT.UN.TO,Top 10 Split Trust
U.U.TO,Sprott Physical Uranium Trust USD
U.UN.TO,Sprott Physical Uranium Trust
UBIL.U.TO,Horizons 0 To 3 Month US T Bill ETF USD
UCSH.U.TO,Horizons USD High Interest Saving US ETF
UDA.TO,Caldwell US Dividend Advantage Fund ETF
UDIV.TO,Manulife Smart U.S. Dividend ETF [Hedged
UDIV.B.TO,Manulife Smart U.S. Dividend ETF Unhedged Units
UDIV.U.TO,Manulife Smart US Dividend ETF USD
ULV.C.TO,Powershares Sp500 Low Volatility ETF
ULV.F.TO,Invesco S&P 500 Low Volatility ETF
ULV.U.TO,Invesco S&P 500 Low Volatility ETF USD
UMAX.TO,Hamilton Utilities Yield Maximizer ETF
UMI.TO,CI Wisdomtree US Midcap Div Idx Hgd ETF
UMI.B.TO,Wisdomtree US Midcap Div Idx Unheg ETF
UMNY.U.TO,CI US Money Market ETF USD
UNC.TO,United Corp Ltd
UNI.TO,Unisync Corp Class B
URB.TO,Urbana Corp
URB.A.TO,Urbana Corp A NV
URC.TO,Uranium Royalty Corp
URC.WT.TO,Uranium Royalty Corp WT
URE.TO,Ur-Energy Inc
USA.TO,Americas Silver Corp
USCC.TO,Horizons US Lrg Cap Eqty Cvrd Call ETF
USCC.U.TO,Horizons US Lrg Cap Eqty Cvrd Call ETF [Usd]
USCL.TO,Horizons Enhnc US Lg Cap Eqt Cvcl ETF
UTIL.TO,Horizons CDN Util Svs High Div Idx ETF
VA.TO,Vanguard FTSE Dev Asia Pac All Cap ETF
VAB.TO,Vanguard CDN Aggregate Bond Index ETF
VALT.TO,CI Gold Bullion Fund ETF Hg CAD
VALT.B.TO,CI Gold Bullion Fund ETF
VALT.U.TO,CI Gold Bullion Fund ETF USD
VBAL.TO,Vanguard Balanced ETF Portfolio
VBNK.TO,Versabank
VBNK.PR.A.TO,Versabank
VCB.TO,Vanguard CDN Corporate Bond Index ETF
VCE.TO,Vanguard FTSE Canada Index ETF
VCIP.TO,Vanguard Conservative Income ETF
VCM.TO,Vecima Networks Inc
VCN.TO,Vanguard FTSE Canada All Cap ETF
VCNS.TO,Vanguard Conservative ETF Portfolio
VDU.TO,Vanguard FTSE Developed AC Ex US ETF
VDY.TO,Vanguard FTSE CDN High Div Yld Index ETF
VE.TO,Vanguard FTSE Dev Europe All Cap ETF
VEE.TO,Vanguard FTSE Emerging Mkts All Cap ETF
VEF.TO,Vanguard FTSE Dev AC Ex US ETF CAD Hdg
VEQT.TO,Vanguard All Equity ETF Portfolio
VET.TO,Vermilion Energy Inc
VFV.TO,Vanguard S&P 500 Index ETF
VGCX.TO,Victoria Gold Corp
VGG.TO,Vanguard US Div Appr ETF
VGH.TO,Vanguard US Div Appr ETF CAD Hdg
VGRO.TO,Vanguard Growth ETF Portfolio
VGV.TO,Vanguard CDN Government Bond Index ETF
VGZ.TO,Vista Gold Corp
VHI.TO,Vitalhub Corp
VI.TO,Vanguard FTSE Dev All Cap Na ETF
VIDY.TO,Vanguard FTSE Dev Ex Na High Div Yld ETF
VIU.TO,Vanguard FTSE Dev All Cap Na ETF
VLB.TO,Vanguard CDN Long Term Bond Index ETF
VLE.TO,Valeura Energy Inc
VLN.TO,Velan Inc Sv
VMO.TO,Vanguard Glob Momentum Factor ETF
VNP.TO,5N Plus Inc
VOXR.TO,Vox Royalty Corp
VPH.TO,Valeo Pharmainc
VQS.TO,Viq Solutions Inc
VRE.TO,Vanguard FTSE CDN Capped REIT Index ETF
VRIF.TO,Vanguard Retirement Income ETF
VRTS.TO,Virtus Investment Partners Inc.
VSB.TO,Vanguard CDN Short-Term Bond Index ETF
VSC.TO,Vanguard CDN Short Term Corp Bd ETF
VSP.TO,Vanguard S&P 500 Index ETF CAD Hdg
VUN.TO,Vanguard US Total Market ETF
VUS.TO,Vanguard US Total Mkt ETF CAD Hdg
VVL.TO,Vanguard Glob Val Factor ETF
VVO.TO,Vanguard Global Min Vol ETF
VXC.TO,Vanguard FTSE Global All Cap Ex Can ETF
VXM.TO,CI Morningstar Intl Value Idx ETF
VXM.B.TO,CI Morningstar Intl Value Idx Unheg
WCM.A.TO,Wilmington Capital Mgmt Inc Cl A NV
WCN.TO,Waste Connections Inc
WCP.TO,Whitecap Resources Inc
WDO.TO,Wesdome Gold Mines Ltd
WEED.TO,Canopy Growth Corp
WEED.DB.TO,Canopy Growth Corporation 8.00%
WEF.TO,Western Forest Products Inc
WELL.TO,Well Health Technologies Corp
WELL.DB.TO,Well Health Technologies 5.5 Pct Debs
WFC.TO,Wall Financial
WFG.TO,West Fraser Timber CO Ltd
WFS.TO,World Financial Split Corp
WFS.PR.A.TO,World Financial Split Corp
WILD.TO,Wildbrain Ltd
WILD.DB.TO,Wildbrain Ltd 5.875 Pct Debs
WJX.TO,Wajax Corp
WJX.DB.TO,Wajax Corp 6.00 Pct Debs
WLLW.TO,Willow Biosciencesinc
WM.TO,Wallbridge Mining Company Ltd
WN.TO,George Weston Limited
WN.PR.A.TO,George Weston Pref Ser 1
WN.PR.C.TO,George Weston 5.20% Pref Ser III
WN.PR.D.TO,George Weston 5.2% Pref Ser IV
WN.PR.E.TO,George Weston 4.75% Pref Ser V
WNDR.TO,Wonderfi Technologies Inc.
WNDR.WT.B.TO,Wonderfi Technologies Inc. Wts B
WOMN.TO,BMO Women IN Leadership Fund
WPK.TO,Winpak Ltd
WPM.TO,Wheaton Precious Metals Corp
WPRT.TO,Westport Fuel Systems Inc
WRG.TO,Western Energy Services Corp
WRN.TO,Western Copper and Gold Corp
WRX.TO,Western Resources Corp
WSP.TO,WSP Global Inc
WSRD.TO,Wealthsimple Dev Mkt Ex Na Soc Resp ETF
WSRI.TO,Wealthsimple Na Socially Resp Index ETF
WTE.TO,Westshore Terminals Investment Corp
WXM.TO,CI Morningstar Cda Momentum Idx ETF
X.TO,TMX Group Ltd
X.DB.A.TO,TMX Group Limited 2.997 Pct Debs
X.DB.B.TO,TMX Group Limited 3.779 Pct Debs
X.DB.C.TO,TMX Group Limited 4.461% Sr B
XAD.TO,Ishares U.S. Aerospace & Defense Index ETF
XAGG.TO,Ishares US Aggregate Bond Index ETF
XAGG.U.TO,Ishares US Aggregate Bond Index ETF USD
XAGH.TO,Ishares US Aggregate Bond Idx ETF CAD HD
XAM.TO,Xanadu Mines Ltd
XAU.TO,Goldmoney Inc
XAW.TO,Ishares Core MSCI All Cntry Ex Can ETF
XAW.U.TO,Ishares Core MSCI All Ex Can ETF USD
XBAL.TO,Ishares Core Balanced ETF Portfolio
XBB.TO,Ishares Core CDN Universe Bond ETF
XBM.TO,Ishares S&P TSX Global Base Mtls ETF
XCB.TO,Ishares Canadian Corporate Bond ETF
XCBG.TO,Ishares ESG Adv CAD Corp Bond Index ETF
XCBU.TO,Ishares US IG Corporate Bond Index ETF
XCBU.U.TO,Ishares US IG Corporate Bond Idx ETF USD
XCD.TO,Ishares S&P Global Cons Disc ETF
XCG.TO,Ishares Canadian Growth Index ETF
XCH.TO,Ishares China Index ETF
XCHP.TO,Ishares Semiconductor Index ETF
XCLN.TO,Ishares Global Clean Energy Index ETF
XCNS.TO,Ishares Core Conservative Balanced ETF
XCS.TO,Ishares S&P TSX Smallcap Index ETF
XCSR.TO,Ishares ESG Advanced MSCI Canada Idx ETF
XCV.TO,Ishares Canadian Value Index ETF
XDG.TO,Ishares Core MSCI Glo Qlty Div ETF
XDG.U.TO,Ishares Core MSCI Glo Qlty Div ETF USD
XDGH.TO,Ishares Core MSCI Glo Qlty Div ETF
XDIV.TO,Ishares Core MSCI CAD Qlty Div ETF
XDNA.TO,Ishares Genomics Immunology and Healthcare Index
XDRV.TO,Ishares Glbl Electric Autonomous Veh ETF
XDSR.TO,Ishares ESG Advanced MSCI EAFE Index ETF
XDU.TO,Ishares Core MSCI US Qlty Div ETF
XDU.U.TO,Ishares Core MSCI US Qlty Div ETF USD
XDUH.TO,Ishares Core MSCI US Qlty Div ETF
XDV.TO,Ishares Canadian Select Div Index ETF
XEB.TO,Ishares JP Morgan USD Emerg Mkts Bd ETF
XEC.TO,Ishares Core MSCI Emerging Mkts IMI ETF
XEC.U.TO,Ishares Core MSCI Emrgng Mkt IMI ETF
XEF.TO,Ishares Core MSCI EAFE IMI Index ETF
XEF.U.TO,Ishares Core MSCI EAFE IMI Index ETF
XEG.TO,Ishares S&P TSX Capped Energy Index ETF
XEH.TO,Ishares MSCI Europe IMI Index ETF
XEI.TO,Ishares S&P TSX Comp High Div Index ETF
XEM.TO,Ishares MSCI Emerging Markets ETF
XEMC.TO,Ishares MSCI Emerg Mkts Ex China Idx ETF
XEN.TO,Ishares Jantzi Social Index ETF
XEQT.TO,Ishares Core Equity ETF
XESG.TO,Ishares ESG MSCI Cda Index ETF
XETM.TO,Ishares TSX Energy Transition Materials Index Et
XEU.TO,Ishares MSCI Europe IMI Index ETF
XEXP.TO,Ishares Exponential Tech Index ETF
XFH.TO,Ishares Core MSCI EAFE IMI Index ETF
XFLB.TO,Ishares Core CDN 15 Year Fed Bnd Idx ETF
XFN.TO,Ishares S&P TSX Capped Financials ETF
XFR.TO,Ishares Floating Rate Index ETF
XGB.TO,Ishares Canadian Govt Bond Index ETF
XGD.TO,Ishares S&P TSX Global Gold Index ETF
XGI.TO,Ishares S&P Global Industrials ETF
XGRO.TO,Ishares Core Growth ETF Portfolio
XHAK.TO,Ishares Cybersecurity and Tech Index ETF
XHB.TO,Ishares CDN Hybrid Corp Bond ETF
XHC.TO,Ishares Global Healthcare Index ETF
XHD.TO,Ishares US High Div Equity Index ETF
XHU.TO,Ishares US High Div Equity Index ETF
XHY.TO,Ishares US High Yield Bond Index ETF
XIC.TO,Ishares Core S&P TSX Capped Comp ETF
XID.TO,Ishares India Index ETF
XIG.TO,Ishares US IG Corporate Bond Index ETF
XIGS.TO,Ishares 1 To 5 Year US IG Corp Bond ETF
XIN.TO,Ishares MSCI EAFE Index ETF
XINC.TO,Ishares Core Income Balanced ETF
XIT.TO,Ishares S&P TSX Capped Info Tech ETF
XIU.TO,Ishares S&P TSX 60 Index ETF
XLB.TO,Ishares Core CDN Long Term Bond ETF
XLVE.TO,Mulvihill US Hlth Care Enhanc Yld ETF
XLY.TO,Auxly Cannabis Group Inc
XMA.TO,Ishares S&P TSX Capped Materials ETF
XMC.TO,Ishares S&P US Midcap Index ETF
XMC.U.TO,Ishares SP US Midcap ETF USD
XMD.TO,Ishares S&P TSX Completion Index ETF
XMF.A.TO,M Split Corp Capital Shares 2014
XMF.PR.B.TO,M Split Corp Class I Pref Shares
XMF.PR.C.TO,M Split Corp Class II Pref Shares 2014
XMH.TO,Ishares S&P US Midcap Index ETF CAD Hgd
XMI.TO,Ishares Edge MSCI Min Vol EAFE ETF
XML.TO,Ishares Edge MSCI Mv EAFE ETF CAD Hgd
XMM.TO,Ishares Edge MSCI Min Vol Emerg ETF
XMS.TO,Ishares Edge MSCI Mv USA ETF CAD Hgd
XMTM.TO,Ishares Edge MSCI USA Momnt Fctr ETF
XMU.TO,Ishares Edge MSCI Min Vol USA ETF
XMU.U.TO,Ishares Edge MSCI Min Vol USA Index ETF
XMV.TO,Ishares Edge MSCI Min Vol Can ETF
XMW.TO,Ishares Edge MSCI Min Vol Gbl ETF
XMY.TO,Ishares Edge MSCI Mv Global ETF CAD Hgd
XPF.TO,Ishares S&P TSX Na Pref Stock ETF
XQB.TO,Ishares High Qlty Canadian Bond ETF
XQLT.TO,Ishares Edge MSCI USA Qlty Fctr Indx ETF
XQQ.TO,Ishares Nasdaq 100 Index ETF
XQQU.TO,Ishares Nasdaq 100 Index ETF
XQQU.U.TO,Ishares Nasdaq 100 Index ETF
XRB.TO,Ishares CDN Real Return Bond Index ETF
XRE.TO,Ishares S&P TSX Capped REIT Index ETF
XSAB.TO,Ishares ESG CDN Agg Bond Index ETF
XSB.TO,Ishares Core CDN Short Trm Bond ETF
XSC.TO,Ishares Cons ST Strat Fix Inc ETF
XSE.TO,Ishares Cons Strat Fix Inc ETF
XSEA.TO,Ishares ESG MSCI EAFE Index ETF
XSEM.TO,Ishares ESG MSCI Emerg Mkts Index ETF
XSH.TO,Ishares Core CDN ST Corp Maple Bnd ETF
XSHG.TO,Ishares ESG Adv 1 To 5 Yr CAD Bd Idx ETF
XSHU.TO,Ishares 1 To 5 Year US IG Corp Bond ETF
XSHU.U.TO,Ishares 1 To 5 Yr US IG Corp Bd ETF USD
XSI.TO,Ishares Short Term Strategic FI ETF
XSMC.TO,Ishares SP US Small Cap Index ETF
XSMH.TO,Ishares SP US Small Cap ETF CAD Hdg
XSP.TO,Ishares Core S&P 500 ETF CAD Hdg ETF
XST.TO,Ishares S&P TSX Capped Cons Stpl ETF
XSTB.TO,Ishares ESG CDN ST Bond Index ETF
XSTH.TO,Ishares 0 To 5 Year TIPS Bond Idx HD ETF
XSTP.TO,Ishares 0 To 5 Year TIPS Bond Index ETF
XSTP.U.TO,Ishares 0 To 5 Yr TIPS Bond Idx ETF USD
XSU.TO,Ishares US Small Cap Index ETF
XSUS.TO,Ishares ESG MSCI USA Index ETF
XTC.TO,Exco Tech
XTD.TO,Tdb Split Corp Class A Shares
XTD.PR.A.TO,Tdb Split Corp Priority Equity Shares
XTG.TO,Xtra Gold Resources Corp
XTLH.TO,Ishares 20 Year US Treasury Bond Hdg ETF
XTLT.TO,Ishares 20 Year US Treasury Bond ETF
XTLT.U.TO,Ishares 20 Year US Treasury Bond ETF USD
XTR.TO,Ishares Diversified Monthly Income ETF
XTRA.TO,Patriot One Technologies Inc
XUH.TO,Ishares Core S&P US Total Mkt ETF CAD Heg
XUS.TO,Ishares Core S&P 500 Index ETF
XUS.U.TO,Ishares Core SP 500 Index ETF
XUSF.TO,Ishares SP US Financials Index ETF
XUSR.TO,Ishares ESG Advanced MSCI USA Index ETF
XUT.TO,Ishares S&P TSX Capped Utilities ETF
XUU.TO,Ishares Core S&P US Total Market ETF
XUU.U.TO,Ishares Core SP US Total Market ETF USD
XVLU.TO,Ishares Edge MSCI USA Value Fctr ETF
XWD.TO,Ishares MSCI World Index ETF
XXM.TO,CI Morningstar US Value Index ETF
XXM.B.TO,CI Morningstr US Value Idx Unhdgd ETF
Y.TO,Yellow Pages Ltd
YCM.TO,Commerce Split Corp Capital Shares
YCM.PR.A.TO,Commerce Split Corp Class I Pref Shares
YCM.PR.B.TO,Commerce Split Corp Class II Pref Shares
YGR.TO,Yangarra Resources Ltd
YRB.TO,Yorbeau Resources Inc
YXM.TO,CI MS US Momentum Index ETF
YXM.B.TO,CI MS US Momentum Unhdgd ETF
ZACE.TO,BMO US All Cap Equity Fund ETF
ZAG.TO,BMO Aggregate Bond Index ETF
ZBAL.TO,BMO Balanced ETF
ZBAL.T.TO,BMO Balanced ETF [Fixed Percentage Distr
ZBBB.TO,BMO BBB Corporate Bond Index ETF
ZBI.TO,BMO Canadian Bank Income Index ETF
ZBK.TO,BMO Equal Weight US Bank ETF
ZCB.TO,BMO Corporate Bond Index ETF
ZCDB.TO,BMO Corporate Discount Bond ETF
ZCH.TO,BMO China Equity Index ETF
ZCLN.TO,BMO Clean Energy Index ETF
ZCM.TO,BMO Mid Corporate Bond ETF
ZCN.TO,BMO S&P TSX Capped Comp ETF
ZCON.TO,BMO Conservative ETF
ZCPB.TO,BMO Core Plus Bond Fund
ZCS.TO,BMO Short Corp Bond ETF
ZCS.L.TO,BMO Short Corporate Bond ETF
ZDB.TO,BMO Discount Bond ETF
ZDH.TO,BMO Intl Div CAD Hedge ETF
ZDI.TO,BMO International Dividend ETF
ZDJ.TO,BMO DJIA Hedged To CAD Index ETF
ZDM.TO,BMO MSCI EAFE Hedged To CAD Index ETF
ZDV.TO,BMO Canadian Dividend ETF
ZDY.TO,BMO US Dividend ETF CAD
ZDY.U.TO,BMO US Dividend ETF USD
ZEA.TO,BMO MSCI EAFE ETF
ZEAT.TO,BMO Global Agriculture ETF
ZEB.TO,BMO S&P TSX Equal Weight Banks Index ETF
ZEF.TO,BMO Emg Mkt Bond Hdgd To CAD ETF
ZEM.TO,BMO MSCI Emerging Markets Index ETF
ZEO.TO,BMO S&P TSX Eql Weight Oil Gas Index ETF
ZEQ.TO,BMO MSCI EU Hq Hcad ETF
ZEQT.TO,BMO All-Equity ETF
ZESG.TO,BMO Balanced ESG ETF
ZFC.TO,BMO Sia Focused Canadian Equity Fund
ZFH.TO,BMO Floating Rate High Yield ETF
ZFL.TO,BMO Long Fed Bond Index ETF
ZFM.TO,BMO Mid Federal Bond Index ETF
ZFN.TO,BMO Sia Focused North American Equity Fu
ZFS.TO,BMO Short Federal Bond Index ETF
ZFS.L.TO,BMO Short Federal Bond Index ETF
ZGB.TO,BMO Government Bond Index ETF
ZGD.TO,BMO S&P TSX Eql Weight Global Gold ETF
ZGI.TO,BMO Global Infrastructure Index ETF
ZGLD.TO,BMO Gold Bullion ETF
ZGLD.U.TO,BMO Gold Bullion ETF USD
ZGLH.TO,BMO Gold Bullion Hedged To CAD ETF
ZGQ.TO,BMO MSCI All Cntry Wrld High Qlty ETF
ZGRN.TO,BMO MSCI ACWI Paris Aligned Climate Equi
ZGRO.TO,BMO Growth ETF
ZGRO.T.TO,BMO Growth ETF
ZGSB.TO,BMO Global Strategic Bond Fund
ZHP.TO,BMO US Pref Share Hgd To CAD ETF
ZHU.TO,BMO Equal Weight US Health Care Idx ETF
ZHY.TO,BMO High Yld US Corp Bnd Hdg CAD ETF
ZIC.TO,BMO Mid Term US IG Corp Bond ETF
ZIC.U.TO,BMO Mid Term US IG Corp Bond ETF USD
ZID.TO,BMO India Equity Index ETF
ZIN.TO,BMO S&P TSX Equal Weight Indstrl ETF
ZIU.TO,BMO S&P/Tsx 60 Index ETF
ZJG.TO,BMO Junior Gold Index ETF
ZJK.TO,BMO High Yield US Corp Bond ETF
ZJK.U.TO,BMO High Yield US Corp Bond Indx ETF USD
ZJPN.TO,BMO Japan Index ETF
ZJPN.F.TO,BMO Japan Index Hdg ETF
ZLB.TO,BMO Low Volatility CAD Equity ETF
ZLC.TO,BMO Long Corporate Bond Index ETF
ZLD.TO,BMO Low Vol Intl Eqty Hed To CAD ETF
ZLE.TO,BMO Low Vol Emerg Mkt Equity ETF
ZLH.TO,BMO Low Vol US Eqty Hed To CAD ETF
ZLI.TO,BMO Low Vol Intl Equity ETF
ZLSC.TO,BMO Long Short Canadian Equity ETF
ZLSU.TO,BMO Long Short US Equity ETF
ZLU.TO,BMO Low Volatility US Equity ETF CAD
ZLU.U.TO,BMO Low Volatility US Equity ETF USD
ZMBS.TO,BMO Canadian MBS Index ETF
ZMI.TO,BMO Monthly Income ETF
ZMI.U.TO,BMO Monthly Income ETF USD
ZMID.TO,BMO SP US Mid Cap Index ETF
ZMID.F.TO,BMO SP US Mid Cap Index ETF Hedged
ZMID.U.TO,BMO SP US Mid Cap Index ETF USD
ZMMK.TO,BMO Money Market Fund ETF
ZMP.TO,BMO Mid Provincial Bond Index ETF
ZMSB.TO,BMO Global Multi Sector Bond Fund
ZMT.TO,BMO Sptsx Eql Wgt Glb Metal Hed CAD ETF
ZMU.TO,BMO Mid Term US IG Corp Bd Hgd CAD Idx
ZNQ.TO,BMO Nasdaq 100 Equity Index ETF
ZNQ.U.TO,BMO Nasdaq 100 Equity Index ETF USD
ZPAY.TO,BMO Premium Yield ETF
ZPAY.F.TO,BMO Premium Yield ETF Hedged
ZPAY.U.TO,BMO Premium Yield ETF USD
ZPH.TO,BMO US Put Write Hedged To CAD ETF
ZPL.TO,BMO Long Provincial Bond Index ETF
ZPR.TO,BMO Laddered Pref Share ETF
ZPR.U.TO,BMO Laddered Pref Share Idx ETF USD
ZPS.TO,BMO Short Provincial Bond Index ETF
ZPS.L.TO,BMO Short Provincial Bond Index ETF
ZPW.TO,BMO US Put Write ETF
ZPW.U.TO,BMO US Put Write ETF USD
ZQB.TO,BMO High Quality Corporate Bond Idx ETF
ZQQ.TO,BMO Nasdaq 100 Hedged To CAD Index ETF
ZRE.TO,BMO Equal Weight Reits Index ETF
ZRR.TO,BMO Real Return Bond Index ETF
ZSB.TO,BMO Short Term Bond Idx ETF
ZSDB.TO,BMO Short Term Discount Bond ETF
ZSML.TO,BMO SP US Small Cap Index ETF
ZSML.F.TO,BMO SP US Small Cap Index ETF Hedged
ZSML.U.TO,BMO SP US Small Cap Index ETF USD
ZSP.TO,BMO S&P 500 Index ETF
ZSP.U.TO,BMO S&P 500 Index ETF USD
ZST.TO,BMO Ultra Short Term Bond ETF
ZST.L.TO,BMO Ultra Short Term Bond ETF
ZSU.TO,BMO ST US IG Corp Bond Hcad ETF
ZTIP.TO,BMO Short Term US TIPS Index ETF
ZTIP.F.TO,BMO Short Term US TIPS Index Hgd ETF
ZTIP.U.TO,BMO Short Term US TIPS Index ETF USD
ZUAG.TO,BMO US Aggregate Bond Index ETF
ZUAG.F.TO,BMO US Aggregate Bond Index ETF Hdg
ZUAG.U.TO,BMO US Aggregate Bond Index ETF USD
ZUB.TO,BMO Eql Wgt US Bank Hdgd To CAD ETF
ZUCM.TO,BMO USD Cash Management ETF
ZUCM.U.TO,BMO USD Cash Management ETF
ZUD.TO,BMO US Dividend Hedged To CAD ETF
ZUE.TO,BMO S&P 500 Hedged CAD ETF
ZUGE.TO,BMO US Equity Growth Mfr Fund ETF
ZUH.TO,BMO Eql Wgt US Hcare Hdgd To CAD ETF
ZUP.TO,BMO US Pref Share Index ETF
ZUP.U.TO,BMO US Pref Share Index ETF
ZUQ.TO,BMO MSCI USA High Quality Index ETF
ZUQ.F.TO,BMO MSCI USA High Quality Index ETF [Hed
ZUQ.U.TO,BMO MSCI USA High Quality Index ETF USD
ZUS.U.TO,BMO Ultra Short Term US Bond ETF USD
ZUS.V.TO,BMO Ultra Short Term US Bond ETF USD Acc
ZUT.TO,BMO Equal Weight Utilities Index ETF
ZUVE.TO,BMO US Equity Value Mfr Fund ETF
ZVC.TO,BMO MSCI Cda Value Index ETF
ZVU.TO,BMO MSCI USA Value Index ETF
ZWA.TO,BMO Covered Call DJIA CAD ETF
ZWB.TO,BMO Covered Call Canadian Banks ETF
ZWB.U.TO,BMO Covered Call Canadian Banks ETF USD
ZWC.TO,BMO CDN High Div Covered Call ETF
ZWE.TO,BMO Europe High Div CC CAD Hedge ETF
ZWEN.TO,BMO Covered Call Energy ETF
ZWG.TO,BMO Gbl High Dividend Covered Call ETF
ZWH.TO,BMO US High Dividend Covered Call ETF
ZWH.U.TO,BMO US High Dividend Cov Call ETF USD
ZWHC.TO,BMO Covered Call Health Care ETF
ZWK.TO,BMO Covered Call US Banks ETF
ZWP.TO,BMO Europe High Div Cov Call ETF
ZWQT.TO,BMO Global Enhanced Income Fund ETF
ZWS.TO,BMO US High Div Cov Call Hgd ETF
ZWT.TO,BMO Covered Call Technology ETF
ZWU.TO,BMO Covered Call Utilities ETF
ZXM.TO,CI Morningstar Intl Momentum Idx ETF
ZXM.B.TO,CI Morningstar Intl Momentum ETF
ZZZ.TO,Sleep Country Canada Holdings Inc
ZZZD.TO,BMO Tactical Dividend ETF Fund
