Symbol,Name
EGIF.TO,Exemplar Growth and Income Fund ETF
EGLX.TO,Enthusiast Gaming Holdings Inc
EHE.TO,CI Wisdomtree Europe Hedged Equity Index ETF
EIF.TO,Exchange Income Corp
EIF.DB.J.TO,Exchange Income Corp 5.35 Pct Debs
EIF.DB.K.TO,Exchange Income Corp 5.75 Pct Debs
EIF.DB.L.TO,Exchange Income Corp 5.25 Pct Debs
EIF.DB.M.TO,Exchange Income Corp 5.25 Pct Debs
EIT.PR.A.TO,Canoe Eit Income Fund Pref Ser 1
EIT.PR.B.TO,Canoe Eit Income Fund Pref Ser 2
EIT.UN.TO,Canoe Eit Income Fund Units
ELD.TO,Eldorado Gold
ELEF.TO,Silver Elephant Mining Corp
ELF.TO,E-L Financial
ELF.PR.F.TO,E-L Financial Corp Ltd Pr Ser. 1
ELF.PR.G.TO,E- L Financial Corp Ltd
ELF.PR.H.TO,E - L Financial Corp Ltd Pref Ser 3
ELO.TO,Eloro Resources Ltd
ELR.TO,Eastern Platinum Ltd
ELVA.TO,Electrovaya Inc
EMA.TO,Emera Incorporated
EMA.PR.A.TO,Emera Inc Series A Pref
EMA.PR.B.TO,Emera Inc Pref Sh Series B
EMA.PR.C.TO,Emera Inc Pref Sh Series C
EMA.PR.E.TO,Emera Inc Pref Ser E
EMA.PR.F.TO,Emera Inc Series F Pref
EMA.PR.H.TO,Emera Inc Pref Series H
EMA.PR.J.TO,Emera Inc
EMA.PR.L.TO,Emera Inc.
EMAX.TO,Hamilton Energy Yield Maximizer ETF
EMP.A.TO,Empire Company Ltd
EMV.B.TO,CI Wisdomtree Emerging Mkts Div Idx ETF
ENB.TO,Enbridge Inc
ENB.PF.A.TO,Enbridge Inc Pref Ser 9
ENB.PF.C.TO,Enbridge Inc Pref Ser 11
ENB.PF.E.TO,Enbridge Inc Pref Ser 13
ENB.PF.G.TO,Enbridge Inc Pref Ser 15
ENB.PF.K.TO,Enbridge Inc Pref Series 19
ENB.PF.U.TO,Enbridge Inc Pref Ser L
ENB.PF.V.TO,Enbridge Inc Pref Ser 5 USD
ENB.PR.A.TO,Enbridge Pr
ENB.PR.B.TO,Enbridge Inc Cum Redeem Pref Ser B
ENB.PR.D.TO,Enbridge Inc Pref Ser D
ENB.PR.F.TO,Enbridge Inc Pref Ser F
ENB.PR.G.TO,Enbridge Inc Pref Series G
ENB.PR.H.TO,Enbridge Inc Pref Ser H
ENB.PR.I.TO,Enbridge Inc Preference Shares Series I
ENB.PR.J.TO,Enbridge Inc Pref Ser 7
ENB.PR.N.TO,Enbridge Inc Pref Ser N
ENB.PR.P.TO,Enbridge Inc Pref Ser P
ENB.PR.T.TO,Enbridge Inc Pref Ser R
ENB.PR.V.TO,Enbridge Inc Pref Ser 1
ENB.PR.Y.TO,Enbridge Inc Cum Red Pref Ser 3
ENCC.TO,Horizons CDN Oil Gas Eqty Cvrd Call ETF
ENCL.TO,Horizons Enh CDN Oil Gas Eqty Cvcl ETF
ENGH.TO,Enghouse Systems Ltd
ENI.UN.TO,Energy Income Fund
ENS.TO,E Split Corp
ENS.PR.A.TO,E Split Corp Pref Shares
EPRX.TO,Eupraxia Pharmaceuticals Inc
EPRX.WT.TO,Eupraxia Pharmaceuticals Inc WT
EPRX.WT.A.TO,Eupraxia Pharmaceuticals Inc. WT
EQB.TO,EQB Inc
EQB.PR.C.TO,Equitable Group Inc Pref Ser 3
EQCL.TO,Horizons Enhanced All-Equity Asset Allocation CO
EQL.TO,Invesco S&P 500 Eql Weight Idx ETF
EQL.F.TO,Invesco S&P 500 Eql Weight Idx ETF Hgd
EQL.U.TO,Invesco S&P 500 Eql Weight Idx ETF USD
EQX.TO,Equinox Gold Corp
ERD.TO,Erdene Resource Development Corp
ERE.UN.TO,European Residential Real Estate Invs. Trust
ERF.TO,Enerplus Corp
ERO.TO,Ero Copper Corp
ESG.TO,Invesco S&P 500 ESG Index ETF
ESG.F.TO,Invesco S&P 500 ESG Index ETF Hedged
ESGA.TO,BMO MSCI Canada ESG Leaders Index ETF
ESGB.TO,BMO ESG Corporate Bond Index ETF
ESGC.TO,Invesco SP TSX Composite ESG Index ETF
ESGE.TO,BMO MSCI EAFE ESG Leaders Index ETF
ESGF.TO,BMO ESG US Corp Bnd Hdgd To CAD Idx ETF
ESGG.TO,BMO MSCI Global ESG Leaders Index ETF
ESGH.TO,BMO ESG High Yld US Corp Bond Index ETF
ESGY.TO,BMO MSCI USA ESG Leaders Index ETF
ESGY.F.TO,BMO MSCI USA ESG Leaders Index ETF
ESI.TO,Ensign Energy Services Inc
ESM.TO,Euro Sun Mining Inc
ESP.TO,Brompton Energy Split Corp. Class A Shares
ESP.PR.A.TO,Brompton Energy Split Corp Preferred
ESPX.TO,Evolve SP 500 Enhanced Yield Fund
ESPX.B.TO,Evolve SP 500 Enhanced Yield Fund Uh
ESPX.U.TO,Evolve SP 500 Enhanced Yield Fund USD
ET.TO,Evertz Technologies Ltd
ETC.TO,Evolve Cryptocurrencies ETF
ETC.U.TO,Evolve Cryptocurrencies ETF USD
ETG.TO,Entree Resources Ltd
ETHH.TO,Purpose Ether CAD ETF
ETHH.B.TO,Purpose Ether Non-Cur Hedg ETF
ETHH.U.TO,Purpose Ether ETF USD
ETHI.TO,Horizons Global Sustain Leaders Idx ETF
ETHQ.TO,3iQ Coinshares Ether ETF
ETHQ.U.TO,3iQ Coinshares Ether ETF USD
ETHR.TO,Ether Unhedg ETF
ETHR.U.TO,Ether ETF USD
ETHX.B.TO,CI Galaxy Ethereum ETF
ETHX.U.TO,CI Galaxy Ethereum ETF USD
ETHY.TO,Purpose Ether Yield ETF
ETHY.B.TO,Purpose Ether Yield ETF
ETHY.U.TO,Purpose Ether Yield ETF USD
ETP.TO,First Trust Global Risk Managed Inc ETF
ETSX.TO,Evolve SP Tsx60 Enhanced Yield Fund
EVO.TO,Evovest Global Equity ETF
EVT.TO,Economic Investment
EXE.TO,Extendicare Inc
EXE.DB.C.TO,Extendicare Inc 5 Pct Debs
EXN.TO,Excellon Resources Inc
EXRO.TO,Exro Technologies Inc
EXRO.WT.TO,Exro Technologies Inc
FANS.TO,Fansunite Entertainment Inc
FAP.TO,Aberdeen Asia-Pacific Income Invest Ltd
FAR.TO,Foraco International Sa
FBGO.TO,Franklin Brandywine Glbl Sust Act ETF
FBT.TO,First Trust NYSE Arca Biotechnology ETF
FBTC.TO,Fidelity Advantage Bitcoin ETF
FBTC.U.TO,Fidelity Advantage Bitcoin ETF USD
FC.TO,Firm Capital Mortgage Inv. Corp
FC.DB.H.TO,Firm Capital Mortgage 5.30 Pct Debs
FC.DB.I.TO,Firm Capital Mtg Inv Corp 5.40 Pct Debs
FC.DB.J.TO,Firm Capital Mtg Inv Corp 5.5 Pct Debs
FC.DB.K.TO,Firm Capital Mrtg Invest Corp 5 Pct Debs
FC.DB.L.TO,Firm Capital Mrtg Invest Corp 5 Pct Debs
FCCB.TO,Fidelity Systematic CDN Bond Index ETF
FCCD.TO,Fidelity CDN High Div Index ETF
FCCL.TO,Fidelity Canadian Low Vol Index ETF
FCCM.TO,Fidelity Canadian Momentum Index ETF
FCCQ.TO,Fidelity Canadian High Quality Index ETF
FCCV.TO,Fidelity Canadian Value Index ETF
FCD.UN.TO,Firm Capital Property Trust
FCGB.TO,Fidelity Global Core Plus Bond ETF
FCGB.U.TO,Fidelity Global Core Plus Bond ETF USD
FCGI.TO,Fidelity Global Monthly High Income ETF
FCID.TO,Fidelity Intl High Dividend Index ETF
FCIG.TO,Fidelity Global Investment Grade Bnd ETF
FCIG.U.TO,Fidelity Global Investmnt Gr Bnd ETF USD
FCII.TO,Franklin Clearbridge Sust Glbl Act ETF
FCIL.TO,Fidelity Intl Low Vol Index ETF
FCIM.TO,Fidelity International Momentum Idx ETF
FCIQ.TO,Fidelity Intl High Quality Index ETF
FCIQ.U.TO,Fidelity Intl High Quality Index ETF USD
FCIV.TO,Fidelity International Value Index ETF
FCMH.TO,Fidelity US Momentum Cur Neut Index ETF
FCMI.TO,Fidelity CDN Monthly High Income ETF
FCMO.TO,Fidelity US Momentum Index ETF
FCQH.TO,Fidelity US High Qlty Cur Ntrl Index ETF
FCR.UN.TO,First Capital REIT Units
FCRH.TO,Fidelity US Div Rising Rates Cur Neu Idx
FCRR.TO,Fidelity US Div For Rising Rates Idx ETF
FCSB.TO,Fidelity Canadian Short Term Corp Bd ETF
FCSI.TO,Franklin Clearbridge Sust Intl Act ETF
FCU.TO,Fission Uranium Corp
FCUD.TO,Fidelity US High Div Index ETF
FCUD.U.TO,Fidelity US High Div Index ETF USD
FCUH.TO,Fidelity US High Div Cur Neu Idx ETF
FCUL.TO,Fidelity US Low Vol Index ETF
FCUL.U.TO,Fidelity US Low Vol Index ETF USD
FCUQ.TO,Fidelity US High Quality Index ETF
FCUQ.U.TO,Fidelity US High Quality Index ETF USD
FCUV.TO,Fidelity US Value Index ETF
FCUV.U.TO,Fidelity US Value Index ETF USD
FCVH.TO,Fidelity US Value Currency Neut Idx ETF
FDGE.TO,Farmers Edge Inc
FDL.TO,First Trust Morningstar Div Ldrs ETF Hgd
FDN.TO,First Trust Dow Jones Internet ETF
FDN.F.TO,First Trust Dow Jones Internet ETF Hgd
FDY.TO,Faraday Copper Corp
FEBB.F.TO,First Trust CBOE Vest US Eqty ETF Feb
FEC.TO,Frontera Energy Corp
FEME.TO,Forstrong Emerging Markets Equity ETF
FETH.TO,Fidelity Advantage Ether ETF
FETH.U.TO,Fidelity Advantage Ether ETF
FF.TO,First Mining Gold Corp
FFH.TO,Fairfax Financial Holdings Ltd
FFH.PR.C.TO,Fairfax Fncl Holdings Ltd Pref Ser C
FFH.PR.D.TO,Fairfax Fncl Holdings Ltd Pref Ser D
FFH.PR.E.TO,Fairfax Financial Hldngs Pref Ser E
FFH.PR.F.TO,Fairfax Financial Holdings Pref Ser F
FFH.PR.G.TO,Fairfax Financial Hldngs Pref Ser G
FFH.PR.H.TO,Fairfax Fncl Holdings Ltd Pref Ser H
FFH.PR.I.TO,Fairfax Financial Holdings Series I Pref
FFH.PR.J.TO,Fairfax Fncl Holdings Ltd Pref Ser J
FFH.PR.K.TO,Fairfax Financial Holdings Pref Ser K
FFH.PR.M.TO,Fairfax Financial Holdings Pref Ser M
FFN.TO,North American Financial 15 Split Corp
FFN.PR.A.TO,North American Fin 15 Split Corp Pref
FGAA.U.TO,Fg Acquisition Corp
FGAA.WT.U.TO,Fg Acquisition Corp. Warrants
FGB.TO,CI Short Term Govt Bond Class ETF
FGGE.TO,Franklin Global Growth Active ETF
FGO.TO,CI Enhanced Govt Bond ETF
FGO.U.TO,CI Enhanced Govt Bond ETF USD
FHG.TO,First Trust US Industrials ETF
FHG.F.TO,First Trust Ad US Industrials ETF
FHH.TO,First Trust US Health Care ETF
FHH.F.TO,First Trust Ad US Health Care ETF
FHI.TO,CI Hlth Care Giant Cov Call ETF
FHI.B.TO,CI Hlth Care Giants Cov Call ETF
FHI.U.TO,CI Health Care Giants Covered Call ETF
FHIS.TO,Franklin Bissett Ultra Shrt Bnd Actv ETF
FHQ.TO,First Trust US Technology ETF
FHQ.F.TO,First Trust Ad US Technology ETF
FIE.TO,Ishares CDN Fin Mthly Income ETF
FIG.TO,CI Investment Grade Bond ETF
FIG.U.TO,CI Investment Grade Bond ETF USD
FIH.U.TO,Fairfax India Holdings Corp USD
FIL.TO,Filo Mining Corp
FINE.TO,Forstrong Glbl Ex North America Eqty ETF
FINO.TO,Franklin Innovation Active ETF
FINT.TO,First Trust Intl Capital Strength ETF
FLCI.TO,Franklin Liberty CDN Invest Grd Corp ETF
FLCP.TO,Franklin Liberty Core Plus Bond ETF
FLDM.TO,Franklin Libertyqt Intl Eqt Index ETF
FLGA.TO,Franklin Liberty Global Agg Bond ETF
FLGD.TO,Franklin Libertyqt Glb Dividend Idx ETF
FLI.TO,CI US Cda Lifeco Covered Call ETF
FLNT.TO,Flint Corp
FLOW.TO,Flow Beverage Corp
FLSD.TO,Franklin Liberty Short Duration Bond ETF
FLUS.TO,Franklin Libertyqt US Eqt Index ETF
FLX.TO,Purpose Glbl Flexible Credit Fnd ETF
FLX.B.TO,Purpose Glbl Flexible Credit Fnd ETF NH
FLX.U.TO,Purpose Glbl Flexible Credit Fnd ETF USD
FM.TO,First Quantum Minerals Ltd
FMAX.TO,Hamilton US Financials Yld Maximizer ETF
FN.TO,First National Financial Corp
FN.PR.A.TO,First National Financial Corp Pref A
FN.PR.B.TO,First National Financial Corp Pref B
FNV.TO,Franco-Nevada Corp
FOM.TO,Foran Mining Corp
FOOD.TO,Goodfood Market Corp
FOOD.DB.TO,Goodfood Market Corp 5.75 Pct Debs
FOOD.DB.A.TO,Goodfood Market Corp. 5.75%
FORA.TO,Verticalscope Holdings Inc
FOUR.TO,Horizons Industry 4.0 Index ETF
FPR.TO,CI Preferred Share ETF
FQC.TO,CI MSCI Can Quality Index Class ETF
FR.TO,First Majestic Silver Corp Common
FRU.TO,Freehold Royalties Ltd
FRX.TO,Fennec Pharmaceuticals Inc
FSB.TO,CI Enhanced Sh Dur Bond Fund
FSB.U.TO,CI Enhanced Sh Dur Bond Fund USD
FSF.TO,CI Global Financial Sector ETF
FSL.TO,First Trust Senior Loan ETF
FST.TO,First Trust CDN Capital Strength ETF
FSV.TO,Firstservice Corp
FSY.TO,Forsys Metals Corp
FSZ.TO,Fiera Capital Corp
FSZ.DB.B.TO,Fiera Capital Corporation 8.25 Pct Debs
FT.TO,Fortune Mnrl J
FTG.TO,Firan Technology Group Corp
FTN.TO,Financial 15 Split Corp
FTN.PR.A.TO,Financial 15 Split Corp
FTS.TO,Fortis Inc
FTS.PR.F.TO,Fortis Inc Pref Shares Series F
FTS.PR.G.TO,Fortis Inc First Pref Ser G
FTS.PR.H.TO,Fortis Inc Pref Ser H
FTS.PR.I.TO,Fortis Inc Pref Ser I
FTS.PR.J.TO,Fortis Inc Pref Ser J
FTS.PR.K.TO,Fortis Inc Pref Ser K
FTS.PR.M.TO,Fortis Inc Pref Ser M
FTT.TO,Finning Intl
FTU.TO,US Financial 15 Split Corp
FTU.PR.B.TO,US Finl 15 Split 2012 Pref Sh
FUD.TO,First Trust Alphadex US Div ETF CAD Hdg
FURY.TO,Fury Gold Mines Ltd
FVI.TO,Fortuna Silver Mines Inc
FVI.DB.U.TO,Fortuna Silver Mines Inc 4.65 Pct Debs
FVL.TO,Freegold Ventures Ltd
FWCP.TO,Franklin Western Asset Core Bnd Actv ETF
FXM.TO,CI Morningstar Cda Value Idx ETF
G.TO,Augusta Gold Corp
GATO.TO,Gatos Silver Inc
GAU.TO,Galiano Gold Inc
GBAL.TO,Ishares ESG Balanced ETF
GBT.TO,Bmtc Group Inc
GCBD.TO,Guardian Canadian Bond ETF
GCFE.TO,Guardian Canadian Focused Equity Fund
GCG.TO,Guardian Capital
GCG.A.TO,Guardian Capital Group Ltd Cl A NV
GCL.TO,Colabor Group Inc
GCNS.TO,Ishares ESG Conservative Balanced ETF
GCSC.TO,Guardian Canadian Sector Controlled Equi
GCTB.TO,Guardian Ultra-Short Canadian T-Bill Fund
GDC.TO,Genesis Land J
GDEP.TO,Guardian Directed Equity Path ETF
GDEP.B.TO,Guardian Directed Equity Path ETF Unhdg
GDI.TO,Gdi Integrated Facility Services Inc
GDL.TO,Goodfellow Inc
GDPY.TO,Guardian Directed Premium Yield ETF
GDPY.B.TO,Guardian Directed Premium Yield ETF Uh
GDV.TO,Global Dividend Growth Split Corp
GDV.PR.A.TO,Global Dividend Growth Split Corp Pref A
GEC.TO,Global Education Communities Corp
GEI.TO,Gibson Energy Inc
GENM.TO,Generation Mining Ltd
GEO.TO,Geodrill Ltd
GEQT.TO,Ishares ESG Equity ETF
GFL.TO,Gfl Environmental Inc
GFP.TO,Greenfirst Forest Products Inc
GFR.TO,Greenfire Resources Ltd.
GGD.TO,Gogold Resources Inc
GGEM.TO,Guardian Fundmntl Emrgng Mkts Equity ETF
GGRO.TO,Ishares ESG Growth ETF
GH.TO,Gamehost Inc
GIB.A.TO,CGI Group Inc Cl A Sv
GIES.TO,Guardian International Equity Select Fund
GIL.TO,Gildan Activewear Inc
GIQG.TO,Guardian I3 Global Quality Growth ETF
GIQG.B.TO,Guardian I3 Global Quality Growth ETF
GIQU.TO,Guardian I3 US Quality Growth Hedg ETF
GIQU.B.TO,Guardian I3 US Quality Growth Unhedg ETF
GIVX.TO,Givex Information Technology Group Ltd
GLCC.TO,Horizons Gold Prod Eqty Cvrd Call ETF
GLG.TO,Glg Life Tech Corp
GLO.TO,Global Atomic Corp
GLXY.TO,Galaxy Digital Holdings Ltd
GMIN.TO,G Mining Ventures Corp
GMTN.TO,Gold Mountain Mining Corp
GMX.TO,Globex Mining Enterprises Inc
GOLD.TO,Goldmining Inc
GOOS.TO,Canada Goose Holdings Inc
GPMD.TO,Guardpath Managed Decumulation 2042 ETF
GRA.TO,Nanoxplore Inc
GRC.TO,Gold Springs Resource Corp
GRCC.TO,Horizons Growth Asset Allocation Covered Call Et
GRID.TO,Tantalus Systems Holding Inc
GRN.TO,Greenlane Renewables Inc
GRNI.TO,BMO Brookfield Gbl Rnwbls Infra Fund ETF
GRT.UN.TO,Granite Real Estate Investment Trust
GSY.TO,Goeasy Ltd
GTE.TO,Gran Tierra Energy Inc
GUD.TO,Knight Therapeutics Inc
GURU.TO,Guru Organic Energy Corp
GUTB.U.TO,Guardian Ultra-Short U.S. T-Bill Fund
GVC.TO,Glacier Media Inc
GWO.TO,Great-West Lifeco Inc
GWO.PR.G.TO,Great-West Lifeco Inc Pr. G
GWO.PR.H.TO,Great-West Lifeco Inc 4.85 % Pr.Ser H
GWO.PR.I.TO,Great-West Lifeco Inc Prf Series I
GWO.PR.L.TO,Great-West Lifeco Inc Pref Ser L
GWO.PR.M.TO,Great West Lifeco Pref Ser M
GWO.PR.N.TO,Great West Lifeco Inc Pref Srs N
GWO.PR.P.TO,Great West Lifeco Inc 5.4 Pct Pref Sh
GWO.PR.Q.TO,Great West Lifeco Pref Ser Q
GWO.PR.R.TO,Great West Lifeco Inc Ser R
GWO.PR.S.TO,Great West Lifeco Pref Ser S
GWO.PR.T.TO,Great West Lifeco Pref Ser T
GWO.PR.Y.TO,Great-West Lifeco Inc.
GXE.TO,Gear Energy Ltd
H.TO,Hydro One Ltd
HAB.TO,Horizons Active Corporate Bond ETF
HAC.TO,Horizons Seasonal Rotation ETF
HAD.TO,Horizons Active CDN Bond ETF
HAF.TO,Horizons Active Global Fixed Income ETF
HAI.TO,Haivision Systems Inc
HAL.TO,Horizons Active CDN Dividend ETF
HARB.TO,Horizons Tactical Absolute Rtrn Bnd ETF
HARB.U.TO,Horizons Tctl Absolute Rtrn Bnd ETF USD
HARC.TO,Horizons Abs Return Global Currency ETF
HAZ.TO,Horizons Active Global Dividend ETF
HBA.TO,Hamilton Australian Banks Equal-Weight ETF
HBAL.TO,Horizons Balanced Tri ETF
HBB.TO,Horizons CDN Select Universe Bond ETF
HBD.TO,Betapro Gold Bullion 2X Daily Bear ETF
HBF.TO,Harvest Brand Leaders Plus Income ETF
HBF.B.TO,Harvest Brand Leaders Plus Inc ETF Unh
HBF.U.TO,Harvest Brand Leaders Plus Income ETF USD
HBFE.TO,Harvest Brand Leaders Enh Income ETF
HBGD.TO,Horizons Big Data Hardware Idx ETF
HBGD.U.TO,Horizons Big Data Hardware Idx ETF USD
HBKD.TO,Betapro Eql Weight Cnd Bank 2X Bear ETF
HBKU.TO,Betapro Eql Weight Cnd Bank 2X Bull ETF
HBLK.TO,Blockchain Technologies ETF
HBM.TO,Hudbay Minerals Inc
HBND.TO,Hamilton U.S. Bond Yield Maximizer ETF
HBNK.TO,Horizons Equal Weight Banks Index ETF
HBP.TO,Helix Biopharm
HBU.TO,Betapro Gold Bullion 2X Daily Bull ETF
HBUG.TO,Horizons Gx Cybersecurity Index ETF Clas
HCA.TO,Hamilton Canadian Bank Mean Reversion ETF
HCAL.TO,Hamilton Canadian Bank ETF
HCLN.TO,Harvest Clean Energy ETF
HCON.TO,Horizons Conservative Tri ETF
HCRE.TO,Horizons Eql Wght Can REIT Index ETF
HDGE.TO,Accelerate Absolute Return Hdg Fund ETF
HDIF.TO,Harvest Diversified Monthly Income ETF
HDIV.TO,Hamilton Enhanced Multi-Sector Covered Call ETF
HEB.TO,Hamilton CDN Bank Equal Weight Idx ETF
HED.TO,Betapro S&P TSX Cap Engy 2X Dly Bear ETF
HEQL.TO,Horizons Enhanced All-Equity Asset Allocation Et
HEQT.TO,Horizons All-Equity Asset Allocation ETF
HERO.TO,Evolve E Gaming Index ETF
HEU.TO,Betapro S&P TSX Cap Engy 2X Dly Bull ETF
HEWB.TO,Horizons Eql Wght Can Banks Index ETF
HFD.TO,Betapro S&P TSX Cap Fncl 2X Dly Bear ETF
HFG.TO,Hamilton Global Financials ETF
HFIN.TO,Hamilton Enhanced Canadian Financials Et
HFPC.U.TO,Helios Fairfax Partners Corp
HFR.TO,Horizons Active Floating Rate Bond ETF
HFU.TO,Betapro S&P TSX Cap Fncl 2X Dly Bull ETF
HGD.TO,Betapro CDN Gold Miners 2X Dly Bear ETF
HGGB.TO,Horizons SP Green Bond Index ETF
HGGG.TO,Harvest Global Gold Giants Index ETF
HGR.TO,Harvest Global REIT Leaders Income ETF
HGRW.TO,Horizons Growth Asset Allocation ETF
HGU.TO,Betapro CDN Gold Miners 2X Dly Bull ETF
HGY.TO,Horizons Gold Yield ETF
HHL.TO,Harvest Healthcare Leaders Income ETF
HHL.B.TO,Harvest Healthcare Leaders Inc ETF Unh
HHL.U.TO,Harvest Healthcare Leaders Income ETF USD
HHLE.TO,Harvest Healthcare Ldrs Enh Income ETF
HIG.TO,Brompton Global Healthcare Inc & Gth ETF
HISU.U.TO,US High Interest Savings Account Fnd ETF
HIU.TO,Betapro Sp500 Daily Inverse ETF
HIX.TO,Betapro S&P TSX 60 Daily Inverse ETF
HLF.TO,High Liner
HLFE.TO,Harvest Canadian Equity Enh Inc Ldrs ETF
HLIF.TO,Harvest Canadian Equity Income Leaders E
HLIT.TO,Horizons Global Lithium Producer Idx ETF
HLPR.TO,Horizons Laddered CDN Pref Index ETF
HLS.TO,Hls Therapeutics Inc
HMAX.TO,Hamilton CDN Financial Yld Maximizer ETF
HMM.A.TO,Hammond Manufacturing Co. Ltd Cl A. Sv
HMMJ.TO,Horizons Marijuana Life Sciences ETF
HMMJ.U.TO,Horizons Marijuana Life Sciences Idx USD
HMP.TO,Horizons Active CDN Municipal Bond ETF
HND.TO,Betapro Nat Gas 2X Daily Bear ETF
HNU.TO,Betapro Nat Gas 2X Daily Bull ETF
HOD.TO,Betapro Crude Oil 2X Daily Bear ETF
HOG.TO,Horizons CDN Midstream Oil Gas ETF
HOM.DB.U.TO,Bsr REIT 5.0 Pct Debs USD
HOM.U.TO,Bsr Real Estate Investment Trust
HOM.UN.TO,Bsr Real Estate Investment Trust
HOT.DB.V.TO,American Hotel Income Prp REIT 6 Pct Deb
HOT.U.TO,American Hotel Income Properties REIT US
HOT.UN.TO,American Hotel Income Properties REIT LP
HOU.TO,Betapro Crude Oil 2X Daily Bull ETF
HPF.TO,Harvest Energy Leaders Plus Income ETF
HPF.U.TO,Harvest Energy Leaders Plus Income ETF USD
HPR.TO,Horizons Active Pref Share ETF
HPS.A.TO,Hammond Power Solutions Inc Cl A. Sv
HPYM.TO,Harvest Premium Yield 7-10 Year Treasury ETF
HPYM.U.TO,Harvest Prem Yld 7 10 Yr Treasury US ETF
HPYT.TO,Harvest Premium Yield Treasury ETF
HPYT.U.TO,Harvest Prem Yield Treasury US ETF
HQD.TO,Betapro Nasdaq 100 2X Daily Bear ETF
HQD.U.TO,Betapro Nasdaq 100 2X Daily Bear ETF USD
HQU.TO,Betapro Nasdaq 100 2X Daily Bull ETF
HR.UN.TO,H&R Real Estate Inv Trust
HRAA.TO,Horizons Resolve Adptv Asset Alloc ETF
HRED.TO,Betapro Eql Wgt CDN REIT 2X Dly Bear ETF
HREU.TO,Betapro Eql Wgt CDN REIT 2X Dly Bull ETF
HRIF.TO,Harvest Diversified Equity Income ETF
HRX.TO,Heroux-Devtek
HSAV.TO,Horizons Cash Maximizer ETF
HSD.TO,Betapro Sp500 2X Daily Bear ETF
HSH.TO,Horizons Sp500 CAD Hedged Index ETF
HSL.TO,Horizons Active Float Rate Sen Loan ETF
HSU.TO,Betapro Sp500 2X Daily Bull ETF
HSUV.U.TO,Horizons USD Cash Maximizer ETF USD
HTA.TO,Harvest Tech Achievers Growth & Income ETF
HTA.B.TO,Harvest Tech Achievers Grwth Inc ETF Unh
HTA.U.TO,Harvest Tech Achievers Growth & Income ETF USD
HTAE.TO,Harvest Tech Achievers Enh Inc ETF
HTB.TO,Horizons US 7 To 10 Yr Treasury Bond ETF
HTB.U.TO,Horizons US 7 To 10 Yr Treas Bd ETF USD
HTL.TO,Hamilton Thorne Ltd
HUBL.TO,Harvest US Bank Leaders Income ETF
HUBL.U.TO,Harvest US Bank Leaders Income ETF USD
HUC.TO,Horizons Crude Oil ETF
HUF.TO,Horizons Active US Float Rate Bd ETF CAD
HUF.U.TO,Horizons Active US Floating Rate Bd ETF
HUG.TO,Horizons Gold ETF
HULC.TO,Horizons US Large Cap Index ETF
HULC.U.TO,Horizons US Large Cap Index ETF USD
HUM.TO,Hamilton U.S. Mid/Small-Cap Financials E
HUN.TO,Horizons Natural Gas ETF
HURA.TO,Horizons Global Uranium Index ETF
HUT.TO,Hut 8 Corp
HUTE.TO,Harvest Eql Weight Glb Util Enh Inc ETF
HUTL.TO,Harvest Eql Wght Glb Util Income ETF
HUTS.TO,Hamilton Enhanced Utilities ETF
HUV.TO,Betapro Sp500 VIX ST Ftrs ETF
HUZ.TO,Horizons Silver ETF
HWO.TO,High Arctic Energy Services Inc
HWX.TO,Headwater Exploration Inc
HXCN.TO,Horizons SP TSX Capped Comp Index ETF
HXD.TO,Betapro S&P TSX 60 2X Daily Bear ETF
HXDM.TO,Horizons Intl Dev Mkts Equity Index ETF
HXDM.U.TO,Horizons Intl Dev Mkts Eqty Idx USD ETF
HXE.TO,Horizons S&P TSX Capped Energy Index ETF
HXEM.TO,Horizons Emerging Mkts Equity Index ETF
HXF.TO,Horizons S&P TSX Capped Fncl Index ETF
HXH.TO,Horizons CDN High Dividend Index ETF
HXQ.TO,Horizons Nasdaq 100 Index ETF
HXQ.U.TO,Horizons Nasdaq 100 Index ETF USD
HXS.TO,Horizons S&P 500 Index ETF
HXS.U.TO,Horizons S&P 500 Index ETF USD
HXT.TO,Horizons S&P Tsx60 Index ETF
HXT.U.TO,Horizons S&P TSX 60 Index ETF USD
HXU.TO,Betapro S&P TSX 60 2X Daily Bull ETF
HXX.TO,Horizons Euro Stoxx 50 Index ETF
HYBR.TO,Horizons Active Hybrd Bond Prf Share ETF
HYDR.TO,Horizons Global Hydrogen Index ETF
HYI.TO,Horizons Active High Yield Bond ETF
HYLD.TO,Hamilton Enhanced U.S. Covered Call ETF
HYLD.U.TO,Hamilton Enhanced US Coverd Call ETF USD
HZD.TO,Betapro Silver 2X Daily Bear ETF
HZM.TO,Horizonte Minerals Plc
HZU.TO,Betapro Silver 2X Daily Bull ETF
IAF.PR.B.TO,Industrial Alliance Cl A Pref Ser B
IAG.TO,IA Financial Corp Inc
IAU.TO,I-80 Gold Corp
IBG.DB.E.TO,Ibi Group Inc 6.50% Listed Senior
ICAE.TO,Invesco TSX Canadian Dividend Aristocrats ESG IN
ICE.TO,Canlan ICE Sports Corp
ICPB.TO,IA Clarington Core Plus Bond Fund
ICTE.TO,Invesco SP TSX Comp ESG Tilt Index ETF
IDEF.B.TO,Manulife Smart Interntl Defensive Eq ETF
IDG.TO,Indigo Books & Music Inc
IDIV.B.TO,Manulife Smart International Div ETF
IE.TO,Ivanhoe Electric Inc
IFA.TO,Ifabric Corp
IFC.TO,Intact Financial Corp
IFC.PR.A.TO,Intact Financial Corp Pref Cl A
IFC.PR.C.TO,Intact Financial Corp Pref Cl A
IFC.PR.E.TO,Intact Financial Corp Pref Cl A Ser 5
IFC.PR.F.TO,Intact Financial Corp Pref Shares Ser 6
IFC.PR.G.TO,Intact Financial Corp Pref Shares Ser 7
IFC.PR.I.TO,Intact Financial Corp Pref Shares Ser 9
IFC.PR.K.TO,Intact Financial Corp
IFP.TO,Interfor Corp
IFRF.TO,IA Clarington Floating Rate Income ETF
IGAF.TO,IA Clarington Global Allocation Fund ETF
IGB.TO,Purpose Mngd Duration Invest Bond ETF
IGBT.UN.TO,2028 Investment Grade Bond Trust
IGCF.TO,Pimco Investment Grade Credit Fund
IGEO.TO,IA Clarington Loomis Global Equity Opportunities
IGM.TO,Igm Financial Inc
IGX.TO,Intelgenx Technologies Corp
IIAE.TO,Invesco S&P Intl Dvlp Aristocrats ESG ETF
IIAE.F.TO,Invesco SP Intl Div Aristocrt ESG HD ETF
IICE.TO,Invesco SP Intl Developed ESG ETF
IICE.F.TO,Invesco SP Intl Developed ESG Hdg ETF
III.TO,Imperial Metals Corp
IIMF.TO,Invesco Intl Dev Dyn Mf Idx ETF
IIMF.F.TO,Invesco International Developed Dynamic-Multifac
IIP.UN.TO,Interrent Real Estate Investment Trust
IITE.TO,Invesco SP Intl Develped ESG Tilt ETF
ILGB.TO,IA Clarington Loomis Global Multisector Bond Fun
ILLM.TO,Acuityads Holdings Inc
IMG.TO,Iamgold Corp
IMO.TO,Imperial Oil
IMP.TO,Intermap Tech Corp
INAI.TO,Invesco Morningstar Global Next Gen Ai Index ETF
INAI.F.TO,Invsco Mrnstr Glb Nxt Gen Ai Idx Heg ETF
INC.UN.TO,Income Fin Un
INE.TO,Innergex Renewable Energy Inc
INE.DB.B.TO,Innergex Renewable Energy 4.75 Pct Debs
INE.DB.C.TO,Innergex Renewable Energy 4.65 Pct Debs
INE.PR.A.TO,Innergex Renewable Energy Pref Ser A
INE.PR.C.TO,Innergex Renewable Energy Inc Pref Ser C
INO.UN.TO,Inovalis REIT
INOC.TO,Horizons Inovestor CDN Equity Index ETF
IPCO.TO,International Petroleum Corp
IPO.TO,Inplay Oil Corp
IQD.TO,CI Wisdomtree Intl Qlty Divd Growth Index ETF
IQD.B.TO,CI Wisdomtree Intl Qlty Divd Growth Index ETF
ISCB.TO,IA Clarington Strategic Corporate Bond Fund
ISIF.TO,IA Claringtion Strategic Income Fund ETF
ISV.TO,Information Services Corp
ITE.TO,I3 Energy Plc
ITH.TO,International Tower Hill Mines Ltd
IUAE.TO,Invesco SP US Div Aristocrt ESG ETF
IUCE.TO,Invesco SP US Total Mkt ESG Idx ETF
IUFR.U.TO,Invesco US TR FL Rate Note Idx US ETF
IUMF.TO,Invesco Russell 1000 Dyn Mf Idx ETF
IUMF.F.TO,Invesco Russell 1000 Dyn Mf Idx ETF Ch
IUTE.TO,Invesco SP US Total Mkt ESG Tilt ETF
IUTE.F.TO,Invesco SP US Total Mkt ESG Tilt Hdg ETF
IVN.TO,Ivanhoe Mines Ltd
IVQ.TO,Invesque Inc CAD
IVQ.DB.U.TO,Invesque Inc 5.00 Pct Debs
IVQ.DB.V.TO,Invesque Inc 6.00 Pct Debs USD
IVQ.U.TO,Invesque Inc
IWBE.TO,Invesco ESG Global Bond ETF
IWEB.TO,IA Wealth Enhanced Bond Pool
IXTE.TO,Invesco SP TSX 60 ESG Tilt Index ETF
JAG.TO,Jaguar Mining Inc
JAPN.TO,CI Wisdomtree Japan Equity Index ETF
JAPN.B.TO,CI Wisdomtree Japan Equity Index ETF
JFS.UN.TO,Jft Strategies Fund
JOY.TO,Journey Energy Inc
JWEL.TO,Jamieson Wellness Inc
K.TO,Kinross Gold Corp
KBL.TO,Kbro Linen Inc
KEC.TO,Kiwetinohk Energy Corp
KEG.UN.TO,Keg Royalties Income Fund
KEI.TO,Kolibri Global Energy Inc
KEL.TO,Kelt Exploration Ltd
KEY.TO,Keyera Corp
KILO.TO,Purp Gold Bullion Tu
KILO.B.TO,Purpose Gold Bullion Fund Non Hedged
KILO.U.TO,Purpose Gold Bullion Fund Non Hedged USD
KITS.TO,Kits Eyecare Ltd
KLS.TO,Kelso Technologies Inc
KMP.UN.TO,Killam Apartment REIT
KNT.TO,K92 Mining Inc
KPT.TO,Kp Tissue Inc
KRN.TO,Karnalyte Resources Inc
KRR.TO,Karora Resources Inc
KSI.TO,Kneat.com Inc
KXS.TO,Kinaxis Inc
L.TO,Loblaw CO
L.PR.B.TO,Loblaw Companies Ltd 2nd Pref Ser B
LAAC.TO,Lithium Americas Argentina Corp
LABS.TO,Medipharm Labs Corp
LAC.TO,Lithium Americas Corp
LAM.TO,Laramide Resources Ltd
LAS.A.TO,Lassonde Industries Inc Cl A Sv
LB.TO,Laurentian Bank
LB.PR.H.TO,Laurentian Bank of Cda Pr Ser 13
LBS.TO,Life & Banc Split Corp
LBS.PR.A.TO,Life & Banc Split Corp
LCFS.TO,Tidewater Renewables Ltd
LCS.TO,Brompton Lifeco Split Corp Class A
LCS.PR.A.TO,Brompton Lifeco Split Corp Pref Shares
LEAD.TO,Evolve Future Leadership ETF Hedged
